contract_id,contract_number,start_date,end_date,amount,fiscal_year,purpose,program_id,provider_id,agency_name
1311,CT126020201400199,07/01/2019,06/30/2022,442437,FY2020,COMPASS Afterschool Programming at Forest Hill High School,286,37,DYCD
1312,CT126020200000302,07/01/2019,06/30/2022,232200,FY2020,COMPASS  Explore program  providing legal services.,285,414,DYCD
1313,CT126020200003710,09/01/2019,08/31/2020,578464,FY2020,COMPASS Elementary program at P.S. 114,271,31,DYCD
1314,CT126020200003066,07/01/2019,06/30/2021,597124,FY2021,Afterschool programming at Young Women's Leadership School,279,655,DYCD
1315,CT126020200003722,09/01/2019,08/31/2020,579584,FY2020,COMPASS Elementary program  at P.S.3,271,31,DYCD
1319,CT126020200003711,09/01/2019,08/31/2020,740519,FY2020,COMPASS Elementary program  at P.S. 170,271,31,DYCD
1320,CT126020200003227,09/01/2019,08/31/2020,110235,FY2020,COMPASS Middle School program at The School for Human Rights,279,386,DYCD
1321,CT126020200000753,09/01/2019,08/31/2020,314763,FY2020,COMPASS Elementary program at Warren Street Center,271,106,DYCD
1322,CT126020200000935,09/01/2019,08/31/2020,627168,FY2020,COMPASS Elementary School Program at P.S./I.S. 266 (Q266),271,37,DYCD
1323,CT126020200001473,09/01/2019,08/31/2020,970957,FY2020,COMPASS Elementary School  Program at PS 169,271,3,DYCD
1324,CT126020200000786,09/01/2019,08/31/2020,614093,FY2020,COMPASS Elementary School- Public School 21,271,37,DYCD
1325,CT126020200003376,09/01/2019,08/31/2020,544205,FY2020,COMPASS Elementary program at P.S. 329 Surfside,271,657,DYCD
1326,CT106920200001306,07/01/2019,06/30/2022,16359836.5,FY2020,Immigrant Opportunity Initiative-Renewal,122,207,DSS
1327,CT126020200001548,09/01/2019,08/31/2020,516179,FY2020,COMPASS Middle School  Program at East NY Middle School,279,3,DYCD
1328,CT126020200003604,07/01/2019,06/30/2022,185760,FY2020,COMPASS  Explore Program providing various programs.,285,413,DYCD
1329,CT126020200002480,09/01/2019,08/31/2020,391968,FY2020,COMPASS Elementary program at NEW SOUTH BRONX CENTER,271,607,DYCD
1330,CT126020200001895,09/01/2019,08/31/2020,181878,FY2020,COMPASS Middle School program at P.S./I.S. 278 (M278,279,124,DYCD
1331,CT126020200000788,09/01/2019,08/31/2020,463304,FY2020,COMPASS Elementary School Program at PS 055 Muare (Q055),271,37,DYCD
1332,CT181620200003587,07/01/2019,06/30/2022,721512,FY2020,Vocational Support Services / PHS Transfer,299,418,DOHMH
1333,CT126020200002342,09/01/2019,08/31/2020,816299,FY2020,COMPASS Elementary School program at PS 205,271,357,DYCD
1334,CT126020200003338,09/01/2019,08/31/2020,706788,FY2020,COMPASS Elementary School program at PS 21,271,587,DYCD
1335,CT126020200003339,09/01/2019,08/31/2020,503028,FY2020,COMPASS Elementary School program at PS 095,271,587,DYCD
1336,CT126020200002494,09/01/2019,08/31/2020,692107,FY2020,COMPASS Elementary School program at PS 97,271,357,DYCD
1337,CT106920200003543,04/01/2017,03/31/2020,1,FY2020,Provision of Home Care Services for HCSP Clients,132,658,DSS
1338,CT126020201400171,09/01/2019,08/31/2020,539733,FY2020,COMPASS Elementary Program  at P.S. 089 Cypress Hills,271,526,DYCD
1339,CT126020200003454,03/11/2019,03/10/2022,148500,FY2020,To support Special Initiatives  SYEP Year Round,265,461,DYCD
1340,CT126020200002823,09/01/2019,08/31/2020,384059,FY2020,COMPASS Elementary Program at Greenbelt Recreation Center,271,607,DYCD
1341,CT126020200002808,09/01/2019,08/31/2020,554447,FY2020,COMPASS Elementary program at PS 086 QUEENS (Q086),271,466,DYCD
1342,CT106920200003571,07/01/2019,06/30/2022,4179153.84,FY2020,TEEN RAPP SERVICE and EARLY RAPP SERVICES.,126,659,DSS
1343,CT106920201400096,07/01/2019,06/30/2025,423852,FY2020,Provision of supportive housing for SRO for Homeless Single,203,31,DSS
1344,CT126020200001551,09/01/2019,08/31/2020,337035,FY2020,COMPASS Middle School  program at IS (K136),279,3,DYCD
1345,CT106920201400058,07/01/2019,06/30/2025,119208,FY2020,Supp. hsg for SRO for HSA St. John's Hsg II-355 E165th St Bx,203,660,DSS
1346,CT126020200002717,03/11/2019,03/10/2022,2661500,FY2020,To support Community Based SYEP Older Youth,399,587,DYCD
1347,CT126020200003170,09/01/2019,08/31/2020,224232,FY2020,COMPASS Elementary School  program at PS 138,271,560,DYCD
1348,CT106920201400031,07/01/2019,06/30/2025,1358382,FY2020,supportive housing for SRO for Homeless Single Adult,203,31,DSS
1349,CT126020200002818,03/11/2019,03/10/2022,643950,FY2020,To support Community Based SYEP Older Youth,267,38,DYCD
1350,CT126020200002720,03/11/2019,03/10/2022,773900,FY2020,To support Community Based SYEP Older Youth,399,38,DYCD
1351,CT126020200002101,09/01/2019,08/31/2020,567611,FY2020,COMPASS Elementary at PS 072 DR William Dorney,271,606,DYCD
1352,CT126020200002718,03/11/2019,03/10/2022,1008000,FY2020,To fund School Based SYEP for Younger and Older Youth,280,587,DYCD
1353,CT126020200002734,09/01/2019,08/31/2020,465336,FY2020,COMPASS Middle School  program at Isaac Newton JHS M825,279,560,DYCD
1354,CT126020200002267,09/01/2019,08/31/2020,593331,FY2020,COMPASS Elementary program  at PS 175 Henry H Garnet (M175),271,661,DYCD
1355,CT126020200000995,09/01/2019,08/31/2020,219849,FY2020,COMPASS middle School Program at P.S./I.S. 266 (Q266),279,37,DYCD
1356,CT126020200000787,09/01/2019,08/31/2020,632765,FY2020,COMPASS Elementary program at P.S Holliswood (Q178),271,37,DYCD
1357,CT126020200000934,09/01/2019,08/31/2020,746047,FY2020,COMPASS Elementary School Program at P.S. 115,271,37,DYCD
1358,CT126020200002687,09/01/2019,08/31/2020,475004,FY2020,COMPASS Middle School IS181 Pablo Casals,279,606,DYCD
1359,CT126020200000994,09/01/2019,08/31/2020,222587,FY2020,COMPASS Middle School Program at PS 178 Holliswood (Q178),279,37,DYCD
1360,CT126020200002881,03/11/2019,03/10/2022,720000,FY2020,To fund School Based SYEP for Younger Youth,280,16,DYCD
1361,CT126020200000184,07/01/2019,06/30/2021,986420,FY2021,COMPASS after-school programming at PS 117,271,466,DYCD
1362,CT126020200002918,09/01/2019,08/31/2020,474275,FY2020,COMPASS Elementary program at PS 377 Alejandrina B Degautier,271,68,DYCD
1364,CT126020200002719,03/11/2019,03/10/2022,360000,FY2020,To fund School Based SYEP for Younger and Older Youth,280,663,DYCD
1365,CT126020200000659,09/01/2019,08/31/2020,563997,FY2020,COMPASS Elementary program at PS 15.,271,99,DYCD
1366,CT126020200003017,09/01/2019,08/31/2020,480014,FY2020,COMPASS Middle School program at Intermediate School 230,279,68,DYCD
1367,CT126020200000816,09/01/2019,08/31/2020,411612,FY2020,COMPASS Middle School program at IS 206,279,99,DYCD
1368,CT126020200002807,07/01/2019,06/30/2022,121680,FY2020,COMPASS Explore Program providing youth development services,285,664,DYCD
1369,CT126020200000813,09/01/2019,08/31/2020,454113,FY2020,COMPASS Elementary program at PS 32.,271,99,DYCD
1370,CT126020200002780,03/11/2019,03/10/2022,990350,FY2020,To support Community Based SYEP Older Youth,399,124,DYCD
1371,CT126020200002343,09/01/2019,08/31/2020,1003523,FY2020,COMPASS Elementary School program at PS 105,271,357,DYCD
1372,CT126020200000657,09/01/2019,08/31/2020,569339,FY2020,COMPASS Elementary Program at PS 246,271,99,DYCD
1373,CT126020200002387,09/01/2019,08/31/2020,537945,FY2020,COMPASS Elementary at PS/MS 498 Van Nest Academy,271,606,DYCD
1375,CT126020200000814,09/01/2019,08/31/2020,197302,FY2020,COMPASS Middle School program at Brooklyn Scholars Charter.,279,99,DYCD
1377,CT126020200000818,09/01/2019,08/31/2020,373317,FY2020,COMPASS Middle School program at PS 15.,279,99,DYCD
1378,CT126020200000815,09/01/2019,08/31/2020,248260,FY2020,COMPASS Middle School Program at Essence School,279,99,DYCD
1379,CT126020200000824,09/01/2019,08/31/2020,548395,FY2020,COMPASS Elementary School program at PS 297,271,99,DYCD
1380,CT126020200002688,09/01/2019,08/31/2020,476247,FY2020,COMPASS Middle School program at Urban Assembly Institute,279,655,DYCD
1381,CT126020200002920,09/01/2019,08/31/2020,636266,FY2020,COMPASS Elementary School program at CPC PS 153,271,80,DYCD
1382,CT126020200003334,09/01/2019,08/31/2020,747484,FY2020,COMPASS Elementary School program at PS 020.,271,587,DYCD
1383,CT126020191428231,03/11/2019,03/10/2022,433350,FY2020,To support Community Based SYEP Older Youth,267,218,DYCD
1384,CT126020191428233,03/11/2019,03/10/2022,1089650,FY2020,To support Community Based SYEP Older Youth,399,218,DYCD
1385,CT126020200002237,09/01/2019,08/31/2020,620054,FY2020,COMPASS Elementary School  Program at PS 241 Bklyn,271,666,DYCD
1386,CT106920200002599,04/01/2017,03/31/2020,1,FY2020,Provision of Home Care Services for HCSP Clients,132,667,DSS
1387,CT126020191427017,03/11/2019,03/10/2022,1260000,FY2020,To support Community Based SYEP Younger Youth.,269,37,DYCD
1388,CT126020200001882,09/01/2019,08/31/2020,641591,FY2020,COMPASS Elementary program at PS 088 SENECA (Q088),271,329,DYCD
1389,CT126020200000654,09/01/2019,08/31/2020,397823,FY2020,COMPASS Middle School Program,279,62,DYCD
1390,CT106920191428127,04/01/2017,03/31/2020,1,FY2020,Provision of Home Care Services for HCSP Clients,132,668,DSS
1391,CT126020191425738,03/11/2019,03/10/2022,285600,FY2020,To support Community Based SYEP Younger Youth,269,662,DYCD
1392,CT126020191425737,03/11/2019,03/10/2022,315000,FY2020,To support Community Based SYEP Younger Youth,269,662,DYCD
1393,CT126020200003336,09/01/2019,08/31/2020,632133,FY2020,COMPASS Elementary School program at PS 160,271,587,DYCD
1394,CT126020191425740,03/11/2019,03/10/2022,429750,FY2020,To support Community Based SYEP Older Youth,267,662,DYCD
1395,CT126020191425739,03/11/2019,03/10/2022,472500,FY2020,To support Community Based SYEP Older Youth,399,662,DYCD
1396,CT126020200003340,09/01/2019,08/31/2020,568949,FY2020,COMPASS Elementary School program at Helen Keller School,271,587,DYCD
1398,CT106920200002148,07/01/2019,06/30/2025,4157640,FY2020,Prov. of supportive housing SRO for Homeless Single Adults,203,11,DSS
1399,CT126020191427931,03/11/2019,03/10/2022,768550,FY2020,To support Community Based SYEP Older Youth,399,526,DYCD
1400,CT106920200002373,07/01/2019,06/30/2025,594720,FY2020,Prov. of supportive housing for Single Room Occupancy (SRO),203,670,DSS
1401,CT106920200002164,07/01/2019,06/30/2022,4254877.94,FY2020,Immigrant Opportunity Initiative-Renewal,122,21,DSS
1402,CT126020191428066,03/11/2019,03/10/2022,950600,FY2020,To fund School Based SYEP for Younger and Older Youth,399,526,DYCD
1404,CT126020200000648,09/01/2019,08/31/2020,477022,FY2020,COMPASS Middle School Programs,279,62,DYCD
1407,CT106920200002149,07/01/2019,06/30/2025,609288,FY2020,Prov. of supportive housing SRO for Homeless Single Adults,203,92,DSS
1408,CT126020191423431,03/11/2019,03/10/2022,360000,FY2020,To support Community Based SYEP Younger Youth,269,329,DYCD
1409,CT126020191423306,03/11/2019,03/10/2022,636250,FY2020,To support Community Based SYEP Older Youth,399,31,DYCD
1411,CT126020200000211,07/01/2019,06/30/2022,245904,FY2020,COMPASS Explore Program providing Youth Services,285,99,DYCD
1413,CT126020191427946,03/11/2019,03/10/2022,533900,FY2020,To support  School Based SYEP  programming for Younger Youth,399,507,DYCD
1414,CT126020200001951,09/01/2019,08/31/2020,565368,FY2020,COMPASS Elementary at School of Science & Technology (K152),271,499,DYCD
1415,CT126020191427770,01/01/2019,06/30/2020,37800,FY2020,To provide Opportunity Youth Services in Brooklyn CD2,266,462,DYCD
1416,CT106920200002165,07/01/2019,06/30/2022,473483.76,FY2020,LEGAL SERVICES FOR IMMIGRANTS FUNDED VIA - Renewal,122,672,DSS
1417,CT126020191425728,03/11/2019,03/10/2022,1201200,FY2020,To support Special Initiatives  SYEP Vulnerable Youth,399,278,DYCD
1418,CT126020191425441,03/11/2019,03/10/2022,546000,FY2020,To support School Based SYEP programming for Older Youth,399,133,DYCD
1419,CT126020191427857,03/11/2019,03/10/2022,360000,FY2020,To support Community Based SYEP Younger Youth,269,479,DYCD
1420,CT106920200002173,07/01/2019,06/30/2022,415440.72,FY2020,PROVISION OF LEGAL SERVICES FOR IMMIGRANTS-RENEWAL,122,528,DSS
1421,CT126020191423344,03/11/2019,03/10/2022,575000,FY2020,To support Community Based SYEP Older Youth.,399,556,DYCD
1422,CT126020200000736,09/01/2019,08/31/2020,405710,FY2020,COMPASS Elementary program at PS 304,271,556,DYCD
1423,CT112520200002072,07/01/2019,06/30/2022,1500000,FY2020,PROVIDE CAREGIVER SERVICES FOR THE ELDERLY,455,8,DFTA
1424,CT126020200001953,09/01/2019,08/31/2020,639257,FY2020,COMPASS Elementary at PS 217 (K217),271,499,DYCD
1425,CT126020191423363,03/11/2019,03/10/2022,312800,FY2020,SYEP School Based Older Youth programming,280,448,DYCD
1426,CT126020191426299,03/11/2019,03/10/2022,540000,FY2020,To support Special Initiatives SYEP Vulnerable Youth.,270,37,DYCD
1430,CT106920191428126,04/01/2017,03/31/2020,1,FY2020,Provision of Home Care Services for HCSP Clients,132,674,DSS
1431,CT126020200001547,07/01/2019,06/30/2021,963206,FY2021,COMPASS Elementary School Program at PS 094,271,3,DYCD
1432,CT126020200001651,09/01/2019,08/31/2020,600517,FY2020,COMPASS Elementary School  program at P.S. 15,271,6,DYCD
1433,CT126020200001880,09/01/2019,08/31/2020,414099,FY2020,COMPASS Elementary Program at PS 187,271,675,DYCD
1434,CT126020200001881,09/01/2019,08/31/2020,459511,FY2020,COMPASS Elementary Program at PS 127,271,675,DYCD
1435,CT126020200001921,03/11/2019,03/10/2022,67500,FY2020,To support Special Initiatives  SYEP Year Round,265,529,DYCD
1436,CT106920200001954,07/01/2019,06/30/2022,7306426.61,FY2020,Immigrant Opportunity Initiative-Renewal,122,446,DSS
1437,CT112520200002071,07/01/2019,06/30/2022,2550000,FY2020,PROVIDE CAREGIVER SERVICES TO THE ELDERLY,455,82,DFTA
1438,CT126020200001876,09/01/2019,08/31/2020,369788,FY2020,COMPASS Elementary Program at PS 289,271,675,DYCD
1439,CT126020200002045,07/01/2019,06/30/2022,2174829,FY2020,Manhattanville provides a range of pro-social activities,281,232,DYCD
1440,CT126020200001879,09/01/2019,08/31/2020,393988,FY2020,COMPASS Elementary Program at PS 9,271,675,DYCD
1441,CT126020200000811,09/01/2019,08/30/2020,210456,FY2020,COMPASS Middle School Program at MS 101X.,279,556,DYCD
1442,CT126020200001877,09/01/2019,08/31/2020,373903,FY2020,COMPASS Elementary Program at PS 191,271,675,DYCD
1443,CT126020200001726,09/01/2019,08/31/2020,361830,FY2020,COMPASS Elementary program at PS 307 Daniel Hale Willams,271,16,DYCD
1444,CT126020200000812,09/01/2019,08/31/2020,432238,FY2020,COMPASS Elementary program at Throggs Neck Comm. Center,271,556,DYCD
1445,CT126020200001831,09/01/2019,08/31/2020,395630,FY2020,COMPASS Middle School program at MS 898,279,673,DYCD
1446,CT126020200001937,09/01/2019,08/31/2020,396738,FY2020,COMPASS Middle School program at IS 364,279,675,DYCD
1447,CT126020200001698,09/01/2019,08/31/2020,275252,FY2020,COMPASS Middle School program at PS 048 WILLIAM C WILCOX,279,588,DYCD
1448,CT126020200001938,09/01/2019,08/31/2020,396534,FY2020,COMPASS Middle School program at PS 147,279,675,DYCD
1449,CT126020200001936,09/01/2019,08/31/2020,394276,FY2020,COMPASS Middle School program at IS 228,279,675,DYCD
1450,CT126020200001654,09/01/2019,08/31/2020,483708,FY2020,COMPASS Middle School  program at J.H.S. 185,279,6,DYCD
1451,CT126020191425356,03/11/2019,03/10/2022,1011700,FY2020,SYEP School Based Younger Youth and Older Youth programming,399,37,DYCD
1452,CT126020200003168,07/01/2019,06/30/2021,712400,FY2021,COMPASS  afterschool programming at PS 112,271,560,DYCD
1453,CT126020200003427,07/01/2019,06/30/2021,571982,FY2021,COMPASS  afterschool programming at The Fresh Creek School,271,675,DYCD
1454,CT126020200003424,07/01/2019,06/30/2022,1302102,FY2020,To provide services within Ravenswood Community Center.,281,331,DYCD
1455,CT126020200002057,07/01/2019,06/30/2022,1193439,FY2020,Two Bridges Cornerstone will provide a safe place for friend,281,16,DYCD
1456,CT126020200003423,07/01/2019,06/30/2021,626234,FY2021,COMPASS  afterschool programming at PS 12,271,675,DYCD
1457,CT126020191425143,07/01/2018,06/30/2020,126000,FY2020,To provide Educational Support HS Manhattan CD10,266,503,DYCD
1458,CT126020191427978,03/11/2019,03/10/2022,682200,FY2020,to support Community Based SYEP Older Youth,267,479,DYCD
1459,CT181620200002973,07/01/2019,06/30/2022,2799774,FY2020,Psychosocial Club,451,676,DOHMH
1460,CT126020200000571,07/01/2019,06/30/2022,1565022,FY2020,"Jacob Riis after-school, summer, & recreational programming",281,38,DYCD
1461,CT106920200000297,07/01/2019,06/30/2022,10780571.23,FY2020,Internship Placement Services (IPS) Program,203,409,DSS
1463,CT126020200002241,07/01/2019,06/30/2022,114552,FY2020,COMPASS  Explore Program providing at PS 189,285,666,DYCD
1464,CT126020200003422,07/01/2019,06/30/2021,625854,FY2021,COMPASS  afterschool programming at X345,271,675,DYCD
1465,CT126020200003426,07/01/2019,06/30/2021,724922,FY2021,COMPASS  afterschool programming at PS 148,271,675,DYCD
1466,CT126020200000675,07/01/2019,06/30/2022,115590,FY2020,COMPASS  Explore Program providing prep for boat building,285,302,DYCD
1467,CT126020200002611,07/01/2019,06/30/2022,2183178,FY2020,Sedgwick Community Center + physical and emotional wellbeing,281,662,DYCD
1469,CT126020200002921,07/01/2019,06/30/2022,245211,FY2020,COMPASS High Program providing After School services,286,655,DYCD
1470,CT181620200002537,07/01/2019,06/30/2022,1705122,FY2020,Provide individuals access to affordable housing market,311,632,DOHMH
1472,CT181620200002222,07/01/2019,06/30/2022,10477317,FY2020,Supported SRO Housing Program,450,11,DOHMH
1473,CT126020191425115,03/11/2019,03/10/2022,888000,FY2020,To fund School Based SYEP for Older and Younger Youth,280,65,DYCD
1474,CT126020191425298,03/11/2019,03/10/2022,900600,FY2020,To fund School Based SYEP  for Older Youth,399,6,DYCD
1475,CT181620200001682,07/01/2019,06/30/2028,1977921,FY2020,Supported employment serv adults w/ serious mental illness,329,679,DOHMH
1477,CT126020191427769,03/11/2019,03/10/2022,240000,FY2020,To support  School Based SYEP  prog. for Younger &OlderYouth,280,386,DYCD
1482,CT126020200002448,07/01/2019,06/30/2022,166788,FY2020,COMPASS  Explore Program providing varied programs.,285,234,DYCD
1485,CT126020200000437,07/01/2019,06/30/2022,1671975,FY2020,HANAC Astoria Cornerstone community services,281,65,DYCD
1486,CT126020200002386,07/01/2019,06/30/2022,1516317,FY2020,Woodside Houses will provide education/recreation services,281,145,DYCD
1488,CT126020200002447,07/01/2019,06/30/2022,246327,FY2020,GREGORIO LUPERON HIGH SCHOOL FOR SCIENCE & MATH,286,234,DYCD
1489,CT126020200000752,07/01/2019,06/30/2022,4965408,FY2020,"RICHMOND TERRACE, EDUCATIONAL YOUTH SERVICES",281,302,DYCD
1490,CT126020200001066,07/01/2019,06/30/2022,92880,FY2020,CompassExplore program provides prep/career in boat building,285,78,DYCD
1491,CT126020191428172,03/11/2019,03/10/2022,360000,FY2020,To support Community Based SYEP Younger Youth,269,278,DYCD
1492,CT126020191425729,03/11/2019,03/10/2022,192600,FY2020,To support Special Initiatives SYEP Year Round,265,278,DYCD
1493,CT126020191423321,03/11/2019,03/10/2022,135000,FY2020,To support Special Initiatives SYEP Year Round,265,145,DYCD
1494,CT126020200001546,07/01/2019,06/30/2022,1260000,FY2020,COMPASS  afterschool programming at P.S. 204 Morris Heights,271,606,DYCD
1495,CT126020191425342,03/11/2019,03/10/2022,1256600,FY2020,To support Community Based SYEP Older Youth,399,65,DYCD
1496,CT181620200001577,07/01/2019,06/30/2020,772844,FY2020,Supported SRO (Homeless SMI),311,646,DOHMH
1497,CT126020191426795,03/11/2019,03/10/2022,360000,FY2020,To support Community Based SYEP Younger Youth,269,124,DYCD
1498,CT126020191403288,07/01/2018,06/30/2021,1538457,FY2021,SONYC afterschool services Bronx borough-wide CSDs,279,662,DYCD
1499,CT181620200001893,07/01/2019,06/30/2022,5874006,FY2020,"Advocacy Services, Non-Medicaid Care Coordination",449,682,DOHMH
1500,CT126020200000185,07/01/2019,06/30/2020,483084,FY2020,COMPASS afterschool programming at PS 041,271,587,DYCD
1501,CT181620200001127,07/01/2019,06/30/2022,44133735,FY2020,Supported Housing / ACE / Criminal Justice / CIT / Re-entry,445,463,DOHMH
1502,CT106920191402973,07/01/2018,06/30/2024,717120,FY2020,Provide Supportive Housing of Single Room Occupancy,203,31,DSS
1503,CT181620200001681,07/01/2019,06/30/2022,596520,FY2020,Supported employment service to adults with mental illness,299,683,DOHMH
1504,CT181620200001652,07/01/2019,06/30/2022,596520,FY2020,Program serving individual with autism spectrum disorder,299,683,DOHMH
1505,CT181620200000050,07/01/2019,06/30/2022,301056,FY2020,Recreational and Socialization Services for Individuals wit,298,18,DOHMH
1507,CT181620200000052,07/01/2019,06/30/2022,4483626,FY2020,PSYCHOSOCIAL CLUB / CONGREGATE SUPPORTED HOUSING / MICA,421,190,DOHMH
1508,CT181620200001277,07/01/2019,06/30/2022,1597170,FY2020,Supportive housing,311,582,DOHMH
1510,CT126020200001655,07/01/2019,06/30/2021,915914,FY2021,COMPASS afterschool programming at P.S. 273,271,6,DYCD
1511,CT126020200002281,07/01/2019,06/30/2022,2100579,FY2020,FDC @ Glenwood Cornerstone -Summer Day Camp,281,499,DYCD
1513,CT126020200001711,07/01/2019,06/30/2022,6792405,FY2020,NYCHA Developments: To provide various youth services,281,533,DYCD
1515,CT126020200001699,07/01/2019,06/30/2021,1793846,FY2021,COMPASS school based program services at PS 048 WILLIAM C WI,271,588,DYCD
1516,CT126020200001966,07/01/2019,06/30/2022,548796,FY2020,Enable participants to pursue their personal goals/interests,286,503,DYCD
1518,CT126020200002852,07/01/2019,06/30/2022,244386,FY2020,"To provide STEM, Literacy and  Leadership activities",286,184,DYCD
1519,CT126020200002147,07/01/2019,06/30/2022,232200,FY2020,COMPASS  Explore Program providing careers to boat building.,285,329,DYCD
1520,CT126020200002551,07/01/2019,06/30/2022,181638,FY2020,COMPASS  Explore Program providing preparation for careers,285,184,DYCD
1521,CT181620200001218,07/01/2019,06/30/2028,11388528,FY2020,Provide mental illness individuals/ families access affordab,311,557,DOHMH
1522,CT106920200001381,07/01/2019,06/30/2025,1655490,FY2020,Prov. of supportive housing for SRO for Homeless Single Adul,203,686,DSS
1523,CT126020200001091,09/01/2019,08/31/2020,457210,FY2020,COMPASS Elementary program at  PS 096 joseph Lanzetta (M096),271,16,DYCD
1524,CT112520200001621,07/01/2019,06/30/2022,1731000,FY2020,PROVIDE CAREGIVER SERVICES TO THE ELDERLY,455,220,DFTA
1526,CT126020200000172,07/01/2019,06/30/2021,1124176,FY2020,COMPASS afterschool programming at P.S. 36,271,35,DYCD
1527,CT106920200000444,07/01/2019,06/30/2025,325416,FY2020,Prov. of supportive housing for SRO for Homeless Single Adul,203,31,DSS
1528,CT181620200001474,07/01/2019,06/30/2022,120780,FY2020,Recreational and Socialization Services for Individuals with,298,48,DOHMH
1529,CT181620200001501,07/01/2019,06/30/2022,217647,FY2020,Recreational & social services for individuals with Autism,298,687,DOHMH
1530,CT181620200001278,07/01/2019,06/30/2022,8731727,FY2020,Medically Supervised Outpatient Withdrawal,448,11,DOHMH
1531,CT112520200001504,07/01/2019,06/30/2022,2550000,FY2020,PROVIDE CAREGIVER SERVICES TO THE ELDERLY,455,573,DFTA
1532,CT112520200001490,07/01/2019,06/30/2022,1731000,FY2020,PROVIDE CAREGIVER SERVICES TO THE EDLERLY,455,578,DFTA
1533,CT126020200001174,09/01/2019,08/31/2020,488810,FY2020,COMPASS Elementary Program at Public School 33,271,661,DYCD
1534,CT126020200002731,07/01/2019,06/30/2022,228450,FY2020,COMPASS High: Afterschool services,286,560,DYCD
1535,CT112520200001668,07/01/2019,06/30/2022,2550000,FY2020,PROVIDE CAREGIVER SERVICES TO THE ELDERLY,455,145,DFTA
1537,CT126020200000514,07/01/2019,06/30/2022,2044953,FY2020,Brooklyn Bayview- Summer Camp/ After School Program,281,62,DYCD
1538,CT126020191426387,03/11/2019,03/10/2022,594000,FY2020,To support Special Initiatives  SYEP NYCHA MAP,293,652,DYCD
1540,CT181620200001145,07/01/2019,06/30/2022,17805395,FY2020,Geriatric Outreach/ Mobile Crisis team,446,689,DOHMH
1541,CT181620200000396,07/01/2019,06/30/2022,2177793,FY2020,Early Childhood MH Network,313,371,DOHMH
1542,CT126020200000572,07/01/2019,06/30/2022,92880,FY2020,COMPASS Program to provide training in Boat Building,285,690,DYCD
1543,CT126020200001090,09/01/2019,08/31/2020,388809,FY2020,COMPASS Elementary programs at McCarren Recreation Center,271,16,DYCD
1544,CT181620200001505,07/01/2019,06/30/2021,569070,FY2020,Individuals/families permanent/supportive affordable housing,308,15,DOHMH
1545,CT126020200000931,07/01/2019,06/30/2021,869662,FY2021,COMPASS  afterschool programming at PS 192,271,661,DYCD
1546,CT126020200001089,09/01/2019,08/31/2020,420536,FY2020,COMPASS Elementary program at  Public School 14,271,16,DYCD
1547,CT181620200001503,07/01/2019,06/30/2022,772680,FY2020,Mental health services in schools: children and adolescents,312,662,DOHMH
1548,CT181620200001231,07/01/2019,06/30/2028,7017103,FY2020,Non-Medicaid Care Coordination/ Supported Housing -Scattered,447,691,DOHMH
1549,CT181620200001353,07/01/2019,06/30/2022,555768,FY2020,Clinic Treatment Services,303,162,DOHMH
1550,CT181620200001217,07/01/2019,06/30/2020,517691,FY2020,"Affordable housing for formally homeless, low-income tenants",311,692,DOHMH
1551,CT126020200000774,07/01/2019,06/30/2022,3377721,FY2020,PROVIDE ARRAY OF SKILLS BASED ACTIVITIES FOR YOUTH.,281,280,DYCD
1552,CT126020191426446,03/11/2019,03/10/2022,148500,FY2020,To Support Special Initiatives SYEP  Year Round,265,588,DYCD
1553,CT126020200001411,07/01/2019,06/30/2022,126318,FY2020,"COMPASS  Explore Program providing exploration, career prep",285,693,DYCD
1554,CT126020200001111,09/01/2019,08/31/2020,473998,FY2020,COMPASS Middle School Program at Yeshivath Kehilath Yakov,279,694,DYCD
1555,CT106920200000526,07/01/2019,06/30/2022,417270.15,FY2020,Provision of Legal Services for Immigrants -Renewal,122,294,DSS
1556,CT126020200000621,07/01/2019,06/30/2022,232200,FY2020,COMPASS Explore Program providing career services,285,695,DYCD
1557,CT126020200001354,07/01/2019,06/30/2022,327321,FY2020,COMPASS  Explore Program providing single-focused activities,285,149,DYCD
1558,CT126020191423365,03/11/2019,03/10/2022,472500,FY2020,To support Community Based SYEP Older Youth,267,115,DYCD
