contract_id,contract_number,start_date,end_date,amount,fiscal_year,purpose,program_id,provider_id,agency_name
6413,CT107120121405268,08/08/2011,06/30/2021,120537568,FY2021,Shelter for Adults Services at Skyway at 132-10 S. Conduit,203,904,DSS
6414,CT107120121405266,04/01/2011,06/30/2021,285012291,FY2021,"Singles Housing-The Stadium, 1260 Sedgwick Ave.",203,904,DSS
6415,CT107120111450972,10/10/2010,06/30/2033,92273588,FY2020,SHELTER SERVICES FOR HOMELESS INDIVIDUALS,203,11,DSS
6416,CT107120111442786,03/01/2011,06/30/2020,39155913,FY2020,SCO Beach Avenue Shelter Stand Alone Trans. Adult Residence,203,3,DSS
6417,CT107120111431187,12/01/2010,06/30/2021,128102139,FY2020,SHLTR SRVCS- HMLSS SNGL ADLTS@PARK AVE SHLTR/ RELOCTN SITE,203,768,DSS
6420,CT107120050026659,11/01/2004,06/30/2028,154013037,FY2020,JEROME AVENUE CARE FOR THE HOMELESS HDFC- DROP IN CENTER,203,2251,DSS
6421,CT107120050008488,10/01/2004,06/30/2025,19829431,FY2020,"CARPENTER HS FOR WOMEN AT 385 JERSEY ST, STATEN IS-PROJ HOSP",203,512,DSS
6422,CT107120010003793,07/01/2000,02/28/2022,80880047.31,FY2020,DEVELOP AND OPERATE TRANSITIONAL SHELTER /ADULT SINGLE MEN,203,2252,DSS
6423,CT107199D3876,06/01/1995,05/31/2025,44536117,FY2020,ASSESSMENT AND TRANSITIONAL HOUSING FOR SINGLE ADULTS,203,713,DSS
6425,CT126020201418828,07/01/2019,06/30/2020,14000,FY2020,This program offers services to blind youth.,264,711,DYCD
6428,CT126020201417764,07/01/2019,06/30/2020,58000,FY2020,"To support food distribution, and social services program.",264,862,DYCD
6435,CT126020201417583,07/01/2019,06/30/2020,149500,FY2020,"Support out-of-school activities; homework, physical educ.",264,898,DYCD
6436,CT126020201414776,09/01/2019,08/31/2020,665000,FY2020,COMPASS Middle School  program at PS3 (X003),279,14,DYCD
6442,CT126020201417238,08/01/2019,06/30/2020,35500,FY2020,Supports leadership development training programs,264,2260,DYCD
6443,CT126020201418363,07/01/2019,06/30/2020,56000,FY2020,FUND VISION SCREENING SERVICES AND FREE EYEGLASSES.,264,1962,DYCD
6444,CT126020201417690,07/01/2019,06/30/2020,35704,FY2020,To support ESOL programs in Bronx & NYC districts 4 & 5.,264,40,DYCD
6447,CT126020201418121,07/01/2019,06/30/2020,462292,FY2020,FUND CLEANUP SERVICES IN SELECT COUNCIL DISTRICTS.,264,155,DYCD
6448,CT126020201407967,07/01/2019,06/30/2020,100000,FY2020,"To fund youth leadership skills, public speaking & wellness",264,25,DYCD
6449,CT126020201416306,07/01/2019,06/30/2020,19500,FY2020,To fund programs for immigrants.,264,392,DYCD
6456,CT126020201416864,07/01/2019,06/30/2020,100000,FY2020,To fund nonprofit organization that foster literacy developm,264,3,DYCD
6466,CT126020201412497,07/01/2018,06/30/2020,122248,FY2020,To provide Healthy Family services in Bronx CD 12,283,162,DYCD
6475,CT126020201418572,07/01/2019,06/30/2020,50000,FY2020,Support additional security & a coach to expand programming,264,2269,DYCD
6482,CT126020201418904,07/01/2019,06/30/2020,5000,FY2020,"Support expenses for dance classes, uniforms & space rental",264,2272,DYCD
6483,CT126020201418932,07/01/2019,06/30/2020,6000,FY2020,Provide rhythmic and dance academy to youth,264,2273,DYCD
6491,CT126020201413808,07/01/2019,06/30/2020,10000,FY2020,"To provide events and youth activities, including sports",264,62,DYCD
6493,CT178120201413805,01/01/2020,06/30/2022,323500,FY2020,Work Plus Job Readiness Program,140,2210,DOP
6494,CT126020201414687,07/01/2019,06/30/2020,10000,FY2020,To support the Chinese Orchestra Music program,264,2279,DYCD
6496,CT126020201417447,07/01/2019,06/30/2020,19937,FY2020,To support food pantries and soup kitchens program citywide,264,62,DYCD
6497,CT126020201410998,07/01/2019,06/30/2020,37000,FY2020,This program offers free basketball and handball instruction,264,2280,DYCD
6501,CT126020201418124,07/01/2019,06/30/2020,10000,FY2020,Support Girls Empowerment and Leadership programming.,264,777,DYCD
6502,CT106920201416666,07/01/2019,06/30/2020,250000,FY2020,"Funding to support the Grow, Rise, Lead (G.R.L.) program",126,684,DSS
6505,CT126020201418846,07/01/2019,06/30/2020,20000,FY2020,Funds to support computer based training for youth.,264,368,DYCD
6507,CT181620201419056,07/01/2019,06/30/2020,86000,FY2020,Screen older adults for depression and alcohol/substance use,300,444,DOHMH
6511,CT126020201419640,07/01/2019,06/30/2020,17000,FY2020,To fund summer youth programs.,264,1958,DYCD
6513,CT126020201419190,07/01/2019,06/30/2020,12500,FY2020,"Support planning, research, education & tools for residents",264,2284,DYCD
6518,CT126020201418170,07/01/2019,06/30/2020,220000,FY2020,For Supplemental Sanitation Services in Council District 6.,264,190,DYCD
6521,CT126020201407717,07/01/2019,06/30/2020,62500,FY2020,To provide support to various youth projects.,264,1,DYCD
6525,CT126020201407444,07/01/2019,06/30/2020,30000,FY2020,To support Music Therapy programming and activities.,264,364,DYCD
6526,CT181620201419397,07/01/2019,06/30/2020,20000,FY2020,City Council / Autism Awareness,297,289,DOHMH
6527,CT181620201418739,07/01/2019,06/30/2020,60000,FY2020,Opioid Prevention and Treatment,302,822,DOHMH
6528,CT181620201417928,07/01/2019,06/30/2020,38103,FY2020,"Developmental, Psychological and Behavioral Health Services",302,537,DOHMH
6529,CT107120201409782,07/01/2019,06/30/2020,4772340.09,FY2020,FOOD SERVICES FOR FAMILY SHELTERS,134,630,DSS
6533,CT126020201419194,07/01/2019,06/30/2020,5000,FY2020,Funds will be used to support NYC Cleanup Initiative,264,2291,DYCD
6535,CT126020201412654,07/01/2019,06/30/2020,42500,FY2020,Funding to support the After School Program,264,888,DYCD
6551,CT126020201417716,07/01/2019,06/30/2020,20000,FY2020,Operational expenses including costs for facility usage.,264,2300,DYCD
6552,CT126020201409845,07/01/2019,06/30/2020,94000,FY2020,To support over 275 pantries and soup kitchens citywide,264,477,DYCD
6553,CT106920201417976,07/01/2019,06/30/2020,100000,FY2020,support legal Services for Low Income New Yorkers,120,197,DSS
6554,CT126020201415212,07/01/2019,06/30/2020,95000,FY2020,To support afterschool activities.,264,633,DYCD
6560,CT126020201419188,07/01/2019,06/30/2020,190000,FY2020,To fund support a complete count in the 2020 Census.,264,274,DYCD
6562,CT126020201415392,07/01/2019,06/30/2020,274500,FY2020,Funds to support the Family First Nights program in CD 23.,264,2302,DYCD
6566,CT126020201418409,07/01/2019,06/30/2020,42000,FY2020,Funds will support operational costs related to drop-in ser.,264,797,DYCD
6569,CT126020201416443,07/01/2019,06/30/2020,25000,FY2020,Provide support for a Vocational Counselor and Literacy prog,264,124,DYCD
6575,CT126020201416547,07/01/2019,06/30/2020,50000,FY2020,To support basic literacy.,264,633,DYCD
6576,CT126020201418751,07/01/2019,06/30/2020,45500,FY2020,"This program provides art, academic enrichment and sports",264,16,DYCD
6598,CT126020201419084,07/01/2019,06/30/2020,51000,FY2020,"Funds to provide opportunities, fostering positive relations",264,1419,DYCD
6602,CT126020201418992,07/01/2019,06/30/2020,75000,FY2020,Funds to support a complete count in the Census 2020,264,380,DYCD
6603,CT126020201419051,07/01/2019,06/30/2020,60000,FY2020,Provides food pantries and soup kitchens citywide,264,2319,DYCD
6605,CT181620201418453,07/01/2019,06/30/2020,250000,FY2020,Medicaid Redesign Transition / Mental Health Services,453,110,DOHMH
6611,CT126020201415052,07/01/2019,06/30/2020,187000,FY2020,To provide free waterfront activities and A Greener NYC,264,2323,DYCD
6614,CT126020201419082,07/01/2019,06/30/2020,60000,FY2020,Funds used for computer science program for youth in school.,264,1419,DYCD
6615,CT126020201419021,07/01/2019,06/30/2020,50000,FY2020,"To fund organizing, counseling, and workshops in CD 47.",264,468,DYCD
6627,CT126020201412856,07/01/2019,06/30/2020,105000,FY2020,Support for the Community Land Trust Initiative (CLT).,264,352,DYCD
6631,CT126020201418575,07/01/2019,06/30/2020,84223,FY2020,FUND PROGRAMS AND MOBILE UNITS THAT PROVIDE FOOD TO PANTRIES,264,34,DYCD
6634,CT126020201419636,07/01/2019,06/30/2020,21000,FY2020,To fund soccer youth sporting programs.,264,2331,DYCD
6639,CT126020201415691,07/01/2019,06/30/2020,151937,FY2020,Provides food to over 275 pantries & soup kitchens citywide.,264,344,DYCD
6648,CT126020201416707,07/01/2019,06/30/2020,76000,FY2020,Funds for youth programs that promotes fitness and teamwork.,264,1111,DYCD
6650,CT126020201413666,07/01/2019,06/30/2020,8000,FY2020,This fund support music and dance education programs,264,2334,DYCD
6651,CT126020201415572,07/01/2019,06/30/2020,312000,FY2020,To support free sport-based youth & community dev. programs.,264,2335,DYCD
6655,CT126020201407325,07/01/2019,06/30/2020,20000,FY2020,To provide technology training & learning classes for senior,264,287,DYCD
6686,CT106920201419741,07/01/2019,06/30/2020,24000,FY2020,Provision of Immigrant Opportunities Initiative Services.,120,959,DSS
6687,CT106920201420416,07/01/2019,06/30/2020,5000,FY2020,Funding to support social svcs. - personnel case workers,119,98,DSS
6688,CT126020201418965,07/01/2019,06/30/2020,5000,FY2020,To provide funding support expenses to sports programming,264,2341,DYCD
6694,CT126020201417777,07/01/2019,06/30/2020,130000,FY2020,To support after-school and Summer Program,264,371,DYCD
6696,CT106920201419247,07/01/2019,06/30/2020,5000,FY2020,Prov. of Legal Services for Low-Income Staten Islanders.,120,446,DSS
6697,CT106920201419861,07/01/2019,06/30/2020,5533333,FY2020,Provision of Legal Representation for NY Immigrant Families,120,294,DSS
6702,CT106920201419653,07/01/2019,06/30/2020,25000,FY2020,Prov. to supports legal svcs for recent immigrants,120,795,DSS
6709,CT181620201419787,07/01/2019,06/30/2020,100000,FY2020,Opioid Prevention & Treatment,302,471,DOHMH
6710,CT126020201404444,07/01/2018,06/30/2020,57600,FY2020,To provide Opportunity Youth services in Bronx CD12,266,780,DYCD
6712,CT126020201419066,07/01/2019,06/30/2020,20250,FY2020,"To provide youth activities, sports and educational program.",264,62,DYCD
6714,CT126020201412661,07/01/2019,06/30/2020,92000,FY2020,To provide after school program and family development servi,264,62,DYCD
6719,CT126020201417271,07/01/2019,06/30/2020,51000,FY2020,To support after-School & Summer programming.,264,331,DYCD
6720,CT126020201415694,07/01/2019,06/30/2020,495000,FY2020,To provide funding for Youth Action's general operating cost,264,2346,DYCD
6721,CT126020201416876,07/01/2019,06/30/2020,50000,FY2020,To provide cleaning and graffiti removal services,264,62,DYCD
6750,CT181620201419711,07/01/2019,06/30/2020,165465,FY2020,Autism Awareness / Member Items,297,701,DOHMH
6754,CT126020201419337,07/01/2019,06/30/2020,50000,FY2020,"Support college readiness & social emotional programs, sport",264,558,DYCD
6762,CT126020201417659,07/01/2019,06/30/2020,5000,FY2020,To support distribution of children's items.,264,2358,DYCD
6765,CT126020201420701,07/01/2019,06/30/2020,10000,FY2020,"To support afterschool activities, meals, & full-day srvcs.",264,40,DYCD
6766,CT126020201420522,07/01/2019,06/30/2020,17500,FY2020,To support community education programs.,264,2360,DYCD
6767,CT106920201420778,07/01/2019,06/30/2020,5000,FY2020,"Prov.of funds support social svcs, case mgmt.,emergency svcs",119,98,DSS
6775,CT126020201408853,07/01/2019,06/30/2020,34000,FY2020,To support over 275 pantries & soup kitchens citywide.,264,355,DYCD
6780,CT126020201419891,07/01/2019,06/30/2020,5000,FY2020,"Support the NY Unity race, which promotes health & wellness",264,2363,DYCD
6783,CT126020201416772,07/01/2019,06/30/2020,49500,FY2020,To provide after-school Choral and music programs,264,2365,DYCD
6787,CT126020201418394,07/01/2019,06/30/2020,49375,FY2020,To support leadership development training programs,264,2367,DYCD
6797,CT126020201419609,07/01/2019,06/30/2020,10000,FY2020,Leadership development training programs for young women,264,2373,DYCD
6798,CT126020201420792,07/01/2019,06/30/2020,20000,FY2020,To fund Volleyball Academy Programs.,264,2374,DYCD
6800,CT126020201416099,07/01/2019,06/30/2020,140750,FY2020,To fund programming and services for vetereans.,264,2212,DYCD
6801,CT126020201419610,07/01/2019,06/30/2020,8000,FY2020,Funds support operating expense of young women's basketball,264,2373,DYCD
6803,CT178120201414494,01/01/2020,06/30/2022,323500,FY2020,Work Plus Readiness  Program,140,560,DOP
6804,CT126020201420808,07/01/2019,06/30/2020,10000,FY2020,To support operating cost associated with the food pantry,264,2376,DYCD
6806,CT126020201419851,07/01/2019,06/30/2020,105333,FY2020,To support literacy & reading proficiency program.,264,106,DYCD
6807,CT126020201419550,07/01/2019,06/30/2020,31000,FY2020,Funds for intro to computer science through afterschool.,264,1419,DYCD
6810,CT181620201419546,07/01/2019,06/30/2020,130000,FY2020,Mental Health Services for Veterans,452,510,DOHMH
6817,CT178120201418528,07/01/2019,06/30/2020,130600,FY2020,Crisis Management System Job Readiness,234,93,DOP
6820,CT126020201420344,07/01/2019,06/30/2020,5000,FY2020,To support job training program for public housing residents,264,2381,DYCD
6822,CT178120201418319,01/01/2020,06/30/2022,582300,FY2020,Work Plus Readiness  Program,140,1577,DOP
6827,CT126020201418977,07/01/2019,06/30/2020,37000,FY2020,To support purchase of food and food supplies,264,302,DYCD
6831,CT106920201419329,07/01/2019,06/30/2022,7927754.67,FY2020,Renewal of TEEN RAPP SERVICES,126,572,DSS
6832,CT181620201419338,07/01/2019,06/30/2020,230769,FY2020,Children Under Five initiative,300,673,DOHMH
6839,CT106920201418916,03/01/2020,06/30/2020,414325.81,FY2020,Provision of Jobs Plus Program Services,121,368,DSS
6841,CT100220201415737,07/01/2019,06/30/2020,77500,FY2020,Hate Crime Prevention,204,2384,MOCJ
6856,CT126020201420986,07/01/2019,06/30/2020,50000,FY2020,To support basic literacy for speakers of other language,264,392,DYCD
6857,CT181620201420287,07/01/2018,06/30/2021,448968,FY2020,In-home mental health and crisis intervention services,321,2390,DOHMH
6859,CT181620201420781,07/01/2019,06/30/2020,104916,FY2020,City Council / Autism Awareness,297,48,DOHMH
6861,CT126020201413427,07/01/2019,06/30/2020,50000,FY2020,"To support basic literacy, English for Speakers of Other Lan",264,465,DYCD
6862,CT181620201415486,12/01/2019,11/30/2024,12208604,FY2020,Scattered Site Supportive Housing,308,537,DOHMH
6864,CT126020201420493,07/01/2019,06/30/2020,317000,FY2020,Funds to support fitness programs for people of all ages,264,975,DYCD
6865,CT181620201420418,07/01/2019,06/30/2020,132103,FY2020,"Developmental, Psychological and Behavioral Health Services",300,691,DOHMH
6868,CT126020201420387,07/01/2019,06/30/2020,35000,FY2020,To provide youth services and support services,264,419,DYCD
6873,CT126020201419551,07/01/2019,06/30/2020,48500,FY2020,This program offer lifesaving knowledge health.,264,2392,DYCD
6876,CT126020201420179,07/01/2019,06/30/2020,130000,FY2020,To  support youth leadership and civic engagement,264,49,DYCD
6879,CT126020201419355,07/01/2019,06/30/2020,20500,FY2020,To support senior and youth programs.,264,2393,DYCD
6880,CT126020201419924,07/01/2019,06/30/2020,583500,FY2020,To provide Sports Training and Role Models for Success (STAR,264,2394,DYCD
6885,CT126020201412648,07/01/2019,06/30/2020,42000,FY2020,Fund to support to debate education programs,264,2396,DYCD
6888,CT126020201417448,07/01/2019,06/30/2020,266500,FY2020,Supports Helpline which provides information about the DOE,264,2399,DYCD
6889,CT126020201411703,07/01/2019,06/30/2020,10000,FY2020,Support Young Minds Build Bridges - Pieces for Peace program,264,2400,DYCD
6890,CT126020201418848,07/01/2019,06/30/2020,464000,FY2020,FUND COMPASS NYC FOR CHILDREN  GRADES K-5.,271,335,DYCD
6892,CT126020201419052,07/01/2019,06/30/2020,145000,FY2020,To support programs to foster healthier communities.,264,526,DYCD
6894,CT126020201419623,07/01/2019,06/30/2020,35000,FY2020,For canvassing and organizing in Red Hook and Sunset Park.,264,1213,DYCD
6895,CT126020201417256,07/01/2019,06/30/2020,50000,FY2020,Funds to support leadership training & community service,264,37,DYCD
6897,CT112520201420419,02/01/2020,06/30/2021,726886,FY2020,PROVIDE SENIOR CENTER SERVICES TO OLDER ADULTS,464,547,DFTA
6898,CT126020201418587,07/01/2019,06/30/2020,75000,FY2020,This program support food bank designed soup kitchen,264,2402,DYCD
6901,CT126020201420942,07/01/2019,06/30/2020,68500,FY2020,To fund services for the Brooklyn Waterfront Greenway.,264,2403,DYCD
6902,CT126020201412573,07/01/2019,06/30/2022,228450,FY2020,Flushing High School-2 Hours STEM or Literacy Activities,286,465,DYCD
6903,CT126020201408206,07/01/2019,06/30/2020,5000,FY2020,Funds to support the Lower East Side Hispanic Festival,264,38,DYCD
6904,CT106920201419981,07/01/2019,06/30/2020,380000,FY2020,Prov. of Legal Services to Unaccompanied Minors and Families,120,424,DSS
6905,CT181620201420946,07/01/2019,06/30/2020,159012,FY2020,Autism Spectrum Disorders: Afterschool Recreational Programs,297,943,DOHMH
6909,CT181620201420870,07/01/2019,06/30/2020,250000,FY2020,Assessing young men ages 16-24 for mental health services,300,93,DOHMH
6911,CT126020201417393,07/01/2019,06/30/2020,30000,FY2020,Funds to support a Creative Movement class (ages 4-6),264,2406,DYCD
6912,CT181620201420420,07/01/2019,06/30/2020,162000,FY2020,Geriatric Mental Health,300,689,DOHMH
6913,CT126020201420386,07/01/2019,06/30/2020,50000,FY2020,To service children and adults with guest speakers and event,264,419,DYCD
6914,CT126020201417796,07/01/2019,06/30/2020,25000,FY2020,To provide work readiness training program.,264,2407,DYCD
6915,CT126020201419351,07/01/2019,06/30/2020,90000,FY2020,"To support educational programming, staffing,marketing.",264,2393,DYCD
6916,CT126020201419681,07/01/2019,06/30/2020,315000,FY2020,To support public assistance and help low-income families.,264,165,DYCD
6917,CT112520201420404,02/01/2020,06/30/2021,1620399,FY2020,PROVIDE SENIOR CENTER SERVICES TO OLDER ADULTS,464,547,DFTA
6918,CT126020201416653,07/01/2019,06/30/2020,1018500,FY2020,To provide funding for Tennis and Educational youth programs,264,675,DYCD
6919,CT126020201414671,07/01/2019,06/30/2020,229191,FY2020,To provide a Greener program that improves the environment,264,58,DYCD
6921,CT126020201413429,07/01/2019,06/30/2020,58000,FY2020,Funding will support housing and community services in Counc,264,465,DYCD
6928,CT107120201414088,10/15/2018,06/30/2023,9964490,FY2020,Drop-in -Center & Respite Bed for Homeless Single Adults,235,512,DSS
6929,CT106920201420356,07/01/2019,06/30/2020,100000,FY2020,Provision for legal services to African immigrant families,120,777,DSS
6930,CT126020201418934,07/01/2019,06/30/2020,45000,FY2020,Funds to provide financial counseling & youth development.,264,368,DYCD
6933,CT100220201414042,07/01/2019,06/30/2020,77500,FY2020,Hate Crime Prevention,204,2393,MOCJ
6934,CT126020201418498,07/01/2019,06/30/2020,50000,FY2020,Funds to offset costs of food program,264,2408,DYCD
6935,CT126020201419081,07/01/2019,06/30/2020,22500,FY2020,To support training and curriculum for GSS staff in restorav,264,444,DYCD
6937,CT181620201420446,07/01/2019,06/30/2020,212500,FY2020,Youth risk involved judicial system,300,1577,DOHMH
6938,CT100220201412934,07/01/2019,06/30/2020,77500,FY2020,Hate Crime Prevention,204,307,MOCJ
6940,CT178120201418191,10/01/2019,12/31/2020,320462.64,FY2021,STSJP Parent Support Program,145,99,DOP
6942,CT106920201419321,04/01/2017,03/31/2020,3599050,FY2020,Provision of Home Care Services for HCSP clients,132,206,DSS
6943,CT107120201419612,07/01/2019,06/30/2022,4749624,FY2020,Provision of Medical Services for Homeless Men,236,2199,DSS
6945,CT126020201412456,07/01/2019,06/30/2020,10000,FY2020,Funding to support youth programming.,264,2411,DYCD
6946,CT126020201420806,07/01/2019,06/30/2020,27000,FY2020,To support the Communities For Healthy Food Programs,264,2376,DYCD
6947,CT106920201420546,07/01/2019,06/30/2020,35000,FY2020,Provision of Immigrant Opportunities Initiative FY20 06993,120,94,DSS
6949,CT126020201419534,07/01/2019,06/30/2020,25000,FY2020,To support services for working poor families.,264,465,DYCD
6950,CT126020201419053,07/01/2019,06/30/2020,21111,FY2020,Funds to support babies and family living in poverty.,264,2412,DYCD
6951,CT106920201419491,10/01/2019,06/30/2020,187500,FY2020,Supplemental Nutrition Assistance Program(SNAP) outreach svc,134,44,DSS
6952,CT126020201417326,07/01/2019,06/30/2020,326000,FY2020,"Support direct programming, book distribution, in-home srvcs",264,847,DYCD
6953,CT106920201420516,07/01/2019,06/30/2022,5665856.79,FY2020,Teen Relationship Abuse Prevention Svs.,126,221,DSS
6955,CT106920201419280,03/01/2020,02/28/2021,3228461.5,FY2020,Renewal Of Emergency Shelter Contract,202,570,DSS
6959,CT126020201420951,07/01/2019,06/30/2020,65000,FY2020,Funds will be used for the Youth Drop-In program,264,2414,DYCD
6961,CT126020201420826,07/01/2019,06/30/2020,5750,FY2020,This program provide dance instructions to students,264,2415,DYCD
6962,CT126020201420746,07/01/2019,06/30/2020,40000,FY2020,Provide legal services counseling to immigrant &refugee.,264,535,DYCD
6964,CT126020201413642,07/01/2019,06/30/2020,7500,FY2020,This program support literature theater workshops,264,1314,DYCD
6965,CT126020201416612,07/01/2019,06/30/2020,320000,FY2020,Funds will be used to support veteran services in CD 41.,264,698,DYCD
6966,CT126020201421271,10/01/2019,06/30/2020,7500,FY2020,Funds to operational expenses of social justice programming.,264,2416,DYCD
6967,CT126020201420953,07/01/2019,06/30/2020,400000,FY2020,Funding supports the outer borough LGBT Services Consortium,264,2414,DYCD
6968,CT126020201414911,07/01/2019,06/30/2020,12500,FY2020,To support of cleaning and beautification Midwood areas,264,2417,DYCD
6970,CT126020201420952,07/01/2019,06/30/2020,250000,FY2020,Fund to support services to help empower the LGBQT Services,264,2414,DYCD
6971,CT126020201420642,07/01/2019,06/30/2020,57000,FY2020,Funds for the adult education program.,264,2418,DYCD
6973,CT126020201416706,07/01/2019,06/30/2020,32000,FY2020,Fund to support educational and youth program & activities,264,83,DYCD
6975,CT106920201420930,11/01/2019,10/31/2020,625000,FY2020,Rapid Rehousing services to house city shelter residents,125,197,DSS
6979,CT126020201413007,07/01/2019,06/30/2020,15000,FY2020,To support summer search college prep program,264,2421,DYCD
6982,CT178120201418184,10/01/2019,12/31/2020,131560,FY2021,STSJP Parent Support Program,145,588,DOP
6984,CT106920201416175,03/15/2020,06/30/2020,316884,FY2020,Provision of Job Plus Services,121,38,DSS
6986,CT100220181412127,07/01/2017,06/30/2020,5833672,FY2020,Anti-Gun Violence Services,102,99,MOCJ
6990,CT106920201418558,01/01/2020,03/31/2020,1,FY2020,"Assignment from Hamaspik of Rockland County, Inc - Comp. 2",132,2425,DSS
6999,CT126020201420731,07/01/2019,06/30/2020,375000,FY2020,Support operating expenses of Food Pantry distribution,295,98,DYCD
7001,CT106920201421871,07/01/2019,06/30/2020,5000,FY2020,legal assistance to unrepresented litigants in Housing Court,120,2432,DSS
7011,CT126020201419191,07/01/2019,06/30/2020,30000,FY2020,Funds to support cleaning services in Council District 40,264,2439,DYCD
7017,CT106920201420191,04/01/2020,03/31/2023,1,FY2020,Provision of Home Care Services for HCSP clients,132,142,DSS
7018,CT106920201418421,04/01/2020,03/31/2025,1500000,FY2020,Provision of Senior Affordable Housing Tenant Services,116,82,DSS
7019,CT106920201418395,04/01/2020,03/31/2023,1,FY2020,Provision of Home Care Services for HCPS clients,132,668,DSS
7020,CT106920201418529,04/01/2020,03/31/2023,3315611.43,FY2020,JobsPlus Services in South Bronx,121,40,DSS
7021,CT106920201416510,04/01/2020,03/31/2023,1,FY2020,Provision of Home Care Services for HCPS clients,125,28,DSS
7022,CT106920201414943,04/01/2020,03/31/2023,1,FY2020,Provision of Home Care Services for HCPS clients,132,763,DSS
7023,CT106920201414212,04/01/2020,03/31/2023,1,FY2020,Provide Home Care Services to Medicaid-Eligible Clients,132,813,DSS
7024,CT106920201408236,04/01/2020,03/31/2023,1,FY2020,Provision of Home Care Services for HCSP Clients,132,674,DSS
7025,CT106920201406197,04/01/2020,03/31/2023,1,FY2020,To Provide Home Care Services (HA-HK-DTS) to Medicaid client,132,779,DSS
7026,CT106920201405914,04/01/2020,03/31/2023,1,FY2020,Provide Home Care Services to Medicaid-eligible client,132,779,DSS
7027,CT106920201406154,04/01/2020,03/31/2023,1,FY2020,Provision of Home Care Services (CDPAP) to Medicaid-Eligible,132,761,DSS
7028,CT106920201406032,04/01/2020,03/31/2023,1,FY2020,Provision of Home Care Services for HCPS clients.,132,761,DSS
7029,CT106920201405273,04/01/2020,03/31/2023,1,FY2020,Provision of Home Care Services for HCPS clients,132,774,DSS
7030,CT106920201403302,04/01/2020,03/31/2023,1,FY2020,To Provide Home Care Services to Medicaid-Eligible Clients,132,928,DSS
7031,CT106920201404429,04/01/2020,03/31/2023,1,FY2020,To provide Home Care services (CDPAP) to Medicaid-eligible,132,928,DSS
7032,CT178120201418241,03/01/2020,02/28/2021,2150000,FY2020,NYCHA Neighborhood Employment Services,142,783,DOP
7033,CT126020201420643,11/01/2019,04/30/2023,4525650,FY2020,To support Advance & Earn programming citywide,294,37,DYCD
7035,CT126020201421001,07/01/2019,06/30/2020,6000,FY2020,support operating cost for food pantry,264,151,DYCD
7051,CT126020201420761,07/01/2019,06/30/2020,20000,FY2020,To provide a greener NYC,264,192,DYCD
7053,CT126020201422187,07/01/2019,06/30/2020,12000,FY2020,Funds will be used to support after-school/ summer camp serv,264,588,DYCD
7057,CT181620201422384,07/01/2019,06/30/2020,20000,FY2020,City Council / Autism Awareness,297,228,DOHMH
7065,CT126020201422381,07/01/2019,06/30/2020,5000,FY2020,Support a child abuse prevention training program.,264,2448,DYCD
7066,CT126020201421003,07/01/2019,06/30/2020,20000,FY2020,Funds to be used to support WBID operations.,264,1147,DYCD
7069,CT126020201421603,11/01/2019,04/30/2023,4765650,FY2020,To support Advance & Earn programming citywide,294,448,DYCD
